Baby Geniuses,gmberclark,19 July 2001,I want my 94 minutes of life back,Sadly i can't get that back. The movie was boring with its childish brand of humor and terrible acting. I watched this movie in school as a award for the students who got 4.0. Ironic isn't it? The movie insulted my intelligence along with every kid in the room. I knew it was a family film so i was amazed at the amount of swearing in the film. It just goes to show how far our culture has gone below typical American values (now dead) I would suggest this movie to kids 8 and under otherwise just don't watch it!,1
Baby Geniuses,wolfmoon2,30 September 2022,Low ratings are bogus!,This movie does not deserve the low rating it is getting. It wasn't perfect but it was really good. I haven't been through the ratings to see why but I can only imagine that it must be something political. It is a fun story that talks about the intelligence children have before the "cross over" right around age 2 and become regular babies. Until then they carry some universal knowledge. There is nothing about this film that could be worthy of the 2.5 or the bad reviews. Watch it for yourself and you be the judge. I have never seen a movie with this many major actors that received a rating thos low. I loved it!Edit: I started noticing consistencies in the low ratings. They came in in batches and contain a lot of the same dialog. Either they are bots or some coordinated effort. Who knows why but if they dont like it they can eat sh... diaper gravy!,10
Baby Geniuses,ijtfalcon,14 April 2001,Dare I say Genius?,I think not. This by far is the worst movie I have seen in my entire lifetime. There is not one single funny moment in the entire film and it tries......and tries......and tries. But it only gets worse...and worse...and worse. How could Christopher Lloyd subject himself to this trife? The answer alludes me. There simply aren't enough words in the English language which can describe the crap that is Baby Geniuses.,1
Baby Geniuses,IonicBreezeMachine,20 September 2022,Ill conceived poorly made and without any charm Baby Geniuses is a creative misfire on all levels,Two twin boys Sylvester and Whit (Leo Gerry and Myles Fitzgerald) were born via surrogacy at the request of conglomerate Baby Co. a company manufacturing various baby products and services for the purposes of testing a method of child rearing created by Baby Co. Head Dr. Kinder (Kathleen Turner). While Sylvester was raised in the Baby Co. Habitat to be raised with the "Kinder Method" Kinder arranged Whit to be placed with her niece Robin (Kim Cattrall) and her husband Dan Bobbins (Peter MacNicol) who's performing his own research that suggests babies may have their own language and untapped knowledge. However when Whit uses his genius level skillset to escape Baby Co. This jeopardizes the experiment.Baby Geniuses comes to us from Steven Paul's Crystal Sky Pictures. The project was conceived by Paul when two babies in a Barney's having verbal exchanges in Baby Talk and believed the concept had promise as a mashup of Look Who's Talking and Babe. Making a crude promo using mouth morphing technology the low budget genre label of Sony Triumph Films greenlit the project shortly before their closure and the actual release went through Sony's Tristar label. While the movie was a minor hit earning back $36 million against its $12 million budget the movie was subject to critical panning and was also not well liked by audiences and maintains a spot on IMDb's bottom 100 list and was labeled the worst film of 1999 by Roger Ebert who also placed it on his "Most Hated Films list". In the years since its release Baby Geniuses has maintained a level of presence in the minds of people as an example of bad films (only cemented by some also inferior sequels) and rightly so because it's hard to recognize any merit to Baby Geniuses on any level.The movie tries to one up the Look Who's Talking films by replacing the inner monologues of those films with the illusion of mouth movement from the babies and that's a major reason why this movie doesn't work. While one of the few positive reviews compared this movie to a live-action version of Nickelodeon's Rugrats there's a major difference in that Baby Geniuses is not a cartoon and it's trying to cater to a broader audience than Rugrats (and failing miserably). When Babies talk in animation there's a certain amount of leeway afforded such an outlandish concept because animation allows you to bend and break the laws of reality as needed so long as you create your own internal logic. The babies in Rugrats acted like regular babies only with the roles that they could speak to each other and not the adults and their understanding of the world was limited.While I'm not the biggest fan of the Look Who's Talking series those films also followed their own internal logic and let the babies act natural with most of the humor coming from John Travolta or Kirstie Alley interacting with them while the inner monologue gave vocalization to simple thoughts. Baby Geniuses doesn't work because it's a very sloppy film that has a very confused logic with the whole "Kinder Method" plot not all that well explained the characters of Robbin and Dan Bobbins are very clunkily written with Dan portrayed as this over-the-top milquetoast doormat and Kathleen Turner almost does her performance to Cruella de Vil levels of over the top without any real logic motivating her character. The whole concept behind babies having this secret language and understanding the mysteries of the universe is pretty stupid even by the standards of a comedy but as a comedy it commits the number one mortal sin of comedy: not being funny. Most of the jokes are hackneyed puns slapstick or pop culture references with Sylvester playing the 90s greatest hits as his character is voiced (in his baby language) as though he's a Bart Simpson/Johnathan Taylor Thomas-esque wiseass only without the comic timing and writing needed to pull it off. And to add insult to injury the movie is loaded with product placement as Baby Geniuses features prominent displays of Macy's Baskin Robbins Baby Guess and Playstation so not only are you watching a bad movie you're watching a bad movie that's trying to sell you stuff.Baby Geniuses is a creative void in which imagination charm and humor go to die. There's plenty more I could discuss that's wrong with this film from awful special effects that range from unconvincing to unnerving to the nonsense logic of Baby Co.'s plan but I'm sure others have said as much more eloquently and thoroughly than I can. Just don't watch it.,1
Baby Geniuses,DirkVW,4 April 1999,One of the WORST Movies Ever Made,"Plan 9 From Outer Space" was a bad movie indeed but at least it was fun to watch and fun to laugh at. "Baby Geniuses" was so gosh darn awful that I felt squeamish the entire time waiting for the film to be finished... no I wasn't just bored I was also infuriated that such a film was even made!! I am insulted that Hollywood as sunk so low as to put this piece of garbage out for the rest of us to see.. I'm so glad that Entertainment Weekly gave it an F... though there's not a grade low enough to describe this stupid insultingly dumb trash!!!,1
Baby Geniuses,BevansDesign,3 August 1999,What crap.,I don't really feel like saying too much about such an awful movie so I'll just say this:Do NOT rent buy go out and see or otherwise view this movie in any way. It is PURE CRAP. Not even Christopher Lloyd was good in this movie. That says a lot in my mind. He's supposed to be a HERO not a villain. Like in Back to the Future.I repeat: AVOID THIS MOVIE.,1
Baby Geniuses,montanaj0e,4 November 2003,Who allowed this movie to be made?,Seriously? Who? Its about abunch of "Geniuses" that happen to be babies saying cheezy one liners. The only part that was funny was......well now that I think about it there is no funny parts! I'll tell yah "Lobster Man From Mars" was 20 times better then this.,1
Baby Geniuses,Bobox,3 August 1999,My wife owes me big time,I went to see this because it was her turn to pick and she owes me big time. I think an equivalent payback might be Jerry Springer's Ringmaster or anything with Bruce Willis (she hates Bruce Willis). It should be allowed to cast negative votes for this. What was Christopher Lloyd THINKING????,1
Baby Geniuses,Etoile,28 July 1999,Don't bother. No really.,I am currently serving as a camp counselor for 25 kids all ages 11 and 12. We wanted to rent a movie for them so we checked out "Ever After" and "Baby Geniuses." The kids unanimously voted for the latter (apparently they'd all seen the former already as had I -- twice) so we put it in the VCR and lit up the big-screen TV.That was our mistake. The film is horribly terribly revoltingly bad. It's almost entirely generated through special effects as was "Titanic" but that film won several awards for the effects -- and this is the opposite. The film's sole redeeming feature is that it could be used as an example of what NOT to do with your fancy special effects technology.I logged onto IMDb while the kids were watching the film because I was curious about the age of the actor playing the main character -- the kid in the movie is about 18-24 months old but I was sure the actor was between 7 and 10 years old. The only information I found was that the one actor was actually a set of triplets but of course there was no further information on them.The kids seem to be enjoying it enough though. It's keeping them quiet and that's why we rented the film. I had better make sure they're not throwing popcorn at each other though.,2
Baby Geniuses,vwl,8 April 2000,This movie is AWFUL,Hey- just because we have the technology to make it seem like babies can talk does that mean we should? Not with this movie as an example no. This movie is so bad it gave me a headache. It wasn't cute; in fact it was a little scary. Babies cannot and should not be manipulated like that. It's icky. DON'T SEE THIS MOVIE. Save yourself the pain.,1
Baby Geniuses,delfinhatt,24 March 2018,Rock'n'roll,Good movie but ugly babies! 6/10Who is the big guy in overalls? At first I thought he was their plumber but they were weirdly close to their plumber. Is he a relative to the babies? Is he a farmer?,6
Baby Geniuses,KryptonIsMyEvilFriend,23 July 2000,How dare you!,For all of you who didn't like this movie I say 'screw you'. I was the stunt midget in this movie for baby Sly. I am proud of my work in this fine cinemagraphic acheivement. Without me scenes such as the modeling dance scene and all the fight scenes. Not many of you out there can say I was in a big budget movie or say I worked with fine actors like Dom DeLuize. I even got my own chair with my name on it. How many of you can say I was what made baby Sly sassy and spunky. I worked hard everyday to make it look like that really was a baby dancing and fighting grown men. I think this is one of the funniest movie I have seen. It is right up there with Free Willy. At the end of production I thought it is great to be a stunt midget in this town we call Hollywood.,1
Baby Geniuses,unforgivenmaster737,5 July 2005,I actually puked while watching this film.,Sure you could add the fact that I was sick too but seriously... this movie sucks.To tell you the truth I had some doubts about even writing this... I still have inconceivable nightmares about just how bad this turkey is. And to top it off they actually had the balls to release a sequel.I've seen some terrible movies in my life... "Super Mario Bros." comes to mind instantly... but this is the one film that I could never conquer. I still to this day cannot for the life of me watch this film under any circumstances. It really is the worst movie ever made. That's the most honest statement I've ever made in my entire life and I wholeheartedly mean that.Anyways "Baby Geniuses" has four... count 'em FOUR washed up actors. Not only that they were actually good actors at one time. Christopher Lloyd Kathleen Turner Peter MacNichol and Dom DeLuise all showed up but somehow forgot to act. Wow and I thought "Rat Race" had it bad...Yeah so the entire movie revolves around the evil corporation that Lloyd and Turner run. Apparently all babies can talk in a secret code and it's their job to try and break it. They have a baby nicknamed "Sly" I believe and he's apparently really super smart. Well security's not so good around the corporation so Sly escapes and uses his - i'm not joking here - mad karate skills to finish his victims off. And SURPRISE! He has a twin whose parents are MacNichol and Kim Cattrall.Holy crap it BURRRRRRRRNNNNNSSSSSS!!!!!Anyways yeah you already know the ending. MacNichol and DeLuise stink up the rest of the movie with bad acting. Of course with a script this bad they could have done a lot worse. And like there was any doubt the obnoxiously stupid parents beat the obnoxiously stupid evil overlords. Jesus Christ avoid this movie just like your mother-in-law: at all costs.,1
Baby Geniuses,jacobanersonboi,4 March 2023,Truly a masterpiece in cinema,Baby smart wish my baby smart directory smart like baby. But sometime director a goo goo ga ga if you no like this movie you poopyhead I took 5 year course in movie this movie what I needed in kollige my professor very proud of me for finding this masturpeace akkording to this articul this movie increase baby iq by at least 1 and yah I Think about-um-the generations and they say we wanna make it a better place for our children and our children's children so that they they they know it's a better world for them and think if they can make it a better place There's a place in your heart And I know that it is love And this place could be much brighter than tomorrow And if you really try.,10
Baby Geniuses,jego-30529,23 May 2021,If you haven't seen this movie I am telling you NOT TO.,This is just a disgusting and disturbing movie. I wish people can avoid this movie at all costs. I want to watch a better movie. I would recommend Toy Story 2 not this movie!,1
Baby Geniuses,cinecism-2,2 June 2000,A dirty diaper is more appetizing,Oh how the mighty have fallen. Kathleen Turner used to be the most exciting actress in Hollywood. From "Body Heat" to "Peggy Sue Got Married" to "The War of the Roses" Turner starred in one great film after another in the 1980s. She closes out the �90s though with her worst film ever. "Baby Geniuses" a supposed comedy about genetic superbabies who communicate brilliance through baby talk is a new low for the family film genre. It's not cute it's not clever and it's sure as hell isn't funny. It's absolute sewage.,1
Baby Geniuses,oreokitty,30 March 2010,im going to throw up,I seriously think i threw up watching this "movie".It was so outrageously ridiculous. Just the fact that there are people in this world who enjoyed this movie makes me feel queasy inside. Nobody wants to watch small babys crawling around in a crib while horrible voiceovers who sound about 40 try and act like babys.Thats nooot disturbing or anything. That alone is a recipe for a disastrous movie. But to top it off lets make these Babys SPYS. are you serious!. Ewwww!.Baby geniuses. More like retards. Because not once in the movie does one of the babys actually talk for themselves. And leave the spying or whatever that bull.... was. Because nobody but pedofiles will enjoy that!.and im just going to say that making a baby geniuses 3 was probably the stupidest idea you could think off. If one and two bombed. what makes you think we want to see that again.,1
Baby Geniuses,fanofmoststuff,13 September 2017,Do not believe anything the reviews are saying about this movie!,THIS MOVIE IS UTTER TRASH! It's unfunny boring offensive and terrible! This is why there are still terrible kids films. Do not show your kids this movie. It'll only make them stupid and not grow as people. It may seem like an innocent funny kids movie but IT'S NOT!!! If you want to show your young kids a movie to keep them entertained show them something that'll feed their minds!Here's a few movies that'll do better to your kids than BABY GENIUSES: -Any Disney princess movies. -Any Pixar film -The Lion King -Shrek -Kung Fu Panda And if you want some dumb fun for the family go for the Madagascar movies and Megamind. Any of these movies are 100 times better than BABY GENIUSES!Think that this movie is "underrated" for a reason!,1
Baby Geniuses,vincent_schawl,1 June 2006,Baby Crap,We had to watch this movie for the end of the school year and we'r in 8th grade what was our teacher thinking putting us through this crap they call a movie I couldn't look at the screen without getting a quivery stomach from its stupidity I tried to sleep during it but the words were so annoying all I could do was clench my fists and think about how horrible the movie was the lipsyncing was horrible and the computer generated dancing baby was pathetic Christopher Loyd has a lot more potential then this crap. The jokes the babies always said were horrible and the stupid way the babies could hurt the adults was completely dumb. No one in my class could keep their heads up long enough to watch this crap I'm glad the bell rang before the movie even ended because i think I would have keeled over this movie almost made me sick. Two thumbs down Way Down!!!,1
Baby Geniuses,Markus58,30 March 1999,Save your money....,I took my son to see this movie not knowing anything about the story. As a parent who cares about what goes into my children's brain I cannot recommend this movie. For a "G" rated flick the language was not appropriate and the adult sexual innuendos are going to be over the kid's heads. Pass on this one folks. There's much better entertainment to put in your children's brains.,1
Baby Geniuses,_IG_Reddog,24 June 2001,Bring this sucker down. It doesn't deserve to be above the WORST MOVIE EVER!,Why? Because it IS the worst movie ever. This is only one of two movies I have walked out on. I was forced to sit though it. I left at the last 30 minutes without any notice and went downstairs to play sonic. Horrible effects too much overacting and terrible editing. Whats something good about this movie? Well it is in color. WAIT no! Psycho is in Black and White and so is Young Frankenstein. O well this move would get a 0/1 if possible. I give it a 1/10 cuz thats as low as it goes.,1
Baby Geniuses,rgachile-1,11 March 2006,the first time that I had to GET OUT of the cinema room before movie end,the first time that I had to GET OUT of the cinema room before movie end!!I was late for a movie and my friends and I have not other option that this movie.I just resisted 15 minutes of this "movie" and...I had to run outside the room with my friends!!! WORST FILM EVER WATCHED BY ME IN A CINEMA ROOM!!The best part of the movie were the trailers!!!Now before going to the cinema... I read the comments about the film.That's the better way to enjoy a movie.Best regards,1
Baby Geniuses,ShancyShance,22 June 2003,Give me Rugrats instead anyday...,The idea of babies speaking adult language had not been a fresh and original idea since Look Who's Talking which did it right. This movie did it wrong and ranks amoung the most horrible movies I've seen outside the world of MST3K.The jokes are funny but not in the way they were intended to be. They are funny in their attempts to make you laugh and fail so miserably. Ha ha ha.,1
Baby Geniuses,octave99,29 December 1999,zzzzzzz! Don't wake me so I never have to see this dreck again.,This movie does not deserve a rating at all. Well maybe negative infinity or something.I fell asleep several times during this movie (must be a light sleeper to have actually awoken at all from this Baby Geniuses invoked comatose state).The theatre ushers were gracious enough to sweep me out with the half empty popcorn and drink containers. Shudder to think what might have happened if I awoke during a second consecutive screening of... AAAAAAAACK!,1
Baby Geniuses,Jonesgrl5,4 October 2008,It depends...,I was eight years old when this film came out in 1999 and back then I absolutely loved it. Just recently after remembering how much I loved it then I thought it would be fun to watch it again.That was a mistake because everything about this movie is purely idiotic. What was I thinking? The acting is almost indescribable and the plot is a train wreck.My advice to those out there is that this movie should only be watched by children at the absolute most. Young children and hope that the parents don't have to watch it with them.Kids will love the goofy moments while the parents will cringe. So it depends on your perspective... If you've made it to junior high school then you'll hate this movie.,3
Baby Geniuses,sanddog2,25 May 2000,BBBBOOORRRRRRRIIIIIINNNNGGG,THIS MOVIE WAS SO BORING. i fell asleep twice in this movie it had no key parts no funny parts and it was totally stupid. I hated it. this has to be one of the worst movie of any year. i hope my vote put this movie down to - 1000 (if there was one),1
Baby Geniuses,werewolffromplanetx,20 February 2020,Stupid inane boring garbage,I can't help but wonder why someone thought that this would make a good movie. Outside of the world of Syfy channel movies you would be hard pressed to find a dumber premise. However I sometimes enjoy movies with ridiculous premises but this is not one of them. You would probably have to be a baby to find this funny.,1
Baby Geniuses,thedegenerate,7 March 2001,This Movie Caused My IQ to Decrease,Unfortunately I've sat through this movie on more than one occasion because of my kid brother. There is nothing... I repeat... NOTHING entertaining about this movie. Nothing. It's not funny it's not cute it's not exciting... Well here's a good comparison. It's like gum after you've chewed the flavor out of it. Bland bland bland. The acting? Terrible. The action sequences? Terrible. The jokes? There weren't any jokes in the movie don't look for any. Don't see this movie. I'm sure it has some sort of lasting effect upon the brain.,1
Baby Geniuses,howgooey2000,13 July 2003,A terrible TERRIBLE movie,the only reson they made this movie was to show off their special effects which suck now compared to anything else basiclly a scientest finds out babys speak their own language and are actually smart but this scientest is DUN DUN DUUUUN EVIL so the babys have to stop them (by the way now suddenly the babys can talk to the adults some how) which they do in some stupid unbeliveable way that would only happen if the "evil scientests" were the stupidest pieces of crap ever to walk the face of the earth and I almost forgot Once you turn 2 or 3 or something you forget about having your own language and everything of so all in all:no plot + no effects +no acting= DON'T SEE THIS MOVIEPS. I saw this movie 4 years ago so I might have been going a little easy on itPSS. I dont like saying PS. so im never going to say it againwho the hell says ps anyway,3
