Baby Geniuses,kylehaines96,16 February 2012,Why Did Bob Clark Ever Think This Was A Good Idea?,This is the only film franchise to have all of the films in the franchise to be in IMDb's bottom 100 list. I Have to be a pretty sad man to watch these movies. So why not waste any time I can think of a few good reasons lets dive right into Baby Geniuses.The film is about a group of baby geniuses who are being watched over by Christopher Lloyd and Kathleen Turner. The main baby named Sly was separated from birth by his twin brother Whit. So the 2 babies get switched and the company takes the wrong baby.This movie is awful. Same complaints as the second. Christopher Lloyd and Kathleen Turner WHAT ARE YOU DOING IN THIS STUPID ABOMINATION OF A MOVIE?????!!!!!!?????? The jokes are dumb the story doe not even make sense and this has to be the only film to have not only the worst Saturday Night Fever Parody but the worst running gag in the entire world Diaper Gravy which is exactly what this movie Is!!Rated PG For Rude Behavior And Dialouge.1hr 35min/95min.BOMB/****,1
Baby Geniuses,ThunderKing6,17 August 2021,It's not that bad. Sometimes you need a goofy movie to be relaxtained.,It wasn't that bad. It was just an innocent flick about smart babies going on an adventure. Still it has some elements that put current family movies to shame. 1999-2001 were interesting times for movies now looking back. From the golden age 90s to an okay 00's to today. You gotta ask what happened to the geniuses in hollyweird?Last Words: A fun goofy movie for the children and Fam.,5
Baby Geniuses,injury-65447,22 September 2020,An unholy abomination,I thought I might enjoy this as a joke but it's actually terrifying and unwatchable.,1
Baby Geniuses,foxxesp,23 October 2018,Didn't age well...,I used to like this as a dumb kid. But now viewing this mess of a movie as an adult it's infuriating. I don't know how a few people I've seen defend this with "It's just a kids movie!" when there are many superior kids movies like Pixar movies and Dreamworks movies.Don't show this to anyone above 5 years old.,3
Baby Geniuses,Theraxorterminate,3 August 2016,Who keeps up-voting the positives reviews?,I'd hate to sound like an arrogant person right now but I have to protest and express that I'm flattered to see many positive reviews coming uphill lately while clearly this disaster of a movie used to have back then not just abysmal ratings but thoughtful and understandable reviews that truly had rightful thoughts of what this movie really is.I mean what the bloody hell? Are we to believe that just because it has an incredibly low score it's a good movie? I mean sooner or later I guess even other abysmal movies like Disaster Movie Meet the Spartans or many other movies in Bottom 100 will become watchable films as well?I could literally write my shortest review here by saying that I have always loathed this movie in many different ways. This is simply one of the most abysmal annoying brain-dead disastrous disgusting embarrassing good-for-nothing hopeless horrible idiotic obnoxious pointless terrible and uninspiring movies ever made. I never liked this movie at all when I was little and still to this day I simply loathe the way it is. I would never in my life show this to my young cousins or even my future children.It doesn't even come close or belongs to the genre of "So bad it's good" material. Please go watch other greater movies that deserves way better than this junk. There's just nothing good about this movie it belongs to be forgotten in oblivion forever.-Infinity/10,1
Baby Geniuses,squirrel_burst,31 January 2015,A load of diaper gravy,'Baby Geniuses' wasn't necessarily a bad idea. The conceit of the movie is that babies are born intelligent and speak a language that only they can understand and that as they grow older the forget it and become like us. A scientist has discovered this and tries to prove it while some bad guys... OK maybe the plot sounds idiotic but I have the feeling that something interesting could be done with completely physically inept heroes trying to get away and outsmart the adults that are out to get them. You just need a smart writer. Unfortunately this movie is extraordinarily stupid. It's like the idea was "babies are cute seeing them do non-baby things will be hilarious" was all of the thinking they did before making the actual film. "Baby Geniuses" doesn't show any inventive thinking The same jokes get repeated over and over the unfunny satire makes you wish it would simply go away and nonsensical plot drag this quickly into a near unwatchable mess. To make it even worse the director knew this movie was complete junk and decided to throw in a last minute music video at the end in the hopes that seeing babies laughing at the sound of "Gift Of Love" by Randy Travis would make you forget how terrible the movie was. (VHS January 2012),1
Baby Geniuses,Thornfield2,13 July 2001,Yikes!,I was flipping through some channels a couple of weeks ago and stumbled onto this one on cable. What was this film? Who came up with it? Yikes!I coudn't even watch this whatever it is for 15 minutes! I normally like to see what happens at the end of shows I find on cable even if I vow to never see them again. Who came up with this? Normally I don't like to slam movies because I hate antihype but this movie really was lame. Who came up with this? All the talking babies really did was kinda give me the creeps. Ick.,1
Baby Geniuses,Criz,9 June 1999,The Most Dangerous Film of the Year,"Baby Geniuses" poses by far the greatest threat to moviegoers in 1999 Annette Bening's "In Dreams" notwithstanding.First this pseudo-comedy possesses a heretofore unseen capacity to completely waste your time--two perfectly good hours that you could have spent on something far more constructive for society like playing video games. Second "Baby Geniuses" is basically completely inane fluff that makes "BASEketball" look like a brilliant exploration of the human condition. Consisting of tired Culkinesque "kick the adult in the groin" sight gags "Baby Geniuses" is embarrassingly unfunny. Third and most worrisome this flick has the potential to create havoc with population control. After enduring two hours of these insufferable little brats most viewers will opt for immediate tubal ligation. On the other hand the tiny Carrie Robbins character (played by the most adorable little twins imaginable) was SO SWEET I decided to run out and impregnate my girlfriend.This is an AWFUL PAINFUL film and I just hope I've been able to warn you in time. With so many drawbacks (lame plotline silly dialogue Kathleen Turner and Peter MacNicol as main characters poor special effects: the babies' computer-simulated mouths are completely out of sync with their words) it's amazing this film got made at all. Oh wait it's a Sony picture. That explains everything.,1
Baby Geniuses,GravityLoudHouseLover1,3 October 2017,This Movie is Bad But Not one of the Worst Movie I Have Seen,Hello There Everybody & Today I'm reviewing the Family Comedy from 1999 called Baby Geniuses. This Movie is about this Secret Company called Baby Co. where two Scientist Heep (Christopher Lloyd) & Dr. Elena (Kathleen Turner) hold these Super intelligent babies and the Babies Talk in this Movie which is weird and This is a really Stupid Movie. The Movie also has weird moments like this one scene where I think it was Sly who tells this girl baby to take her clothes of but she will only do it if he takes her out to dinner & this other scene where these Goons From Baby Co. come to take Sly and he sets up this "Home Alone" Trap & both Goons both explain the joke & that was Stupid. This Movie is Really Stupid & it also has very foul language like one baby says A** & Yeah This Movie is bad but not the worst 2/10 p.s. I forgot to mention the soundtrack is really good I mean you Have Taco's "Puttin on the Ritz" & the Bee Gees "Staying Alive" which was Good. I also think I saw this Movie growing up because this Movie came out in March 1999 when I was 2 Years old & I know I Definitely saw this Movie back in 2010 in the Hospital.,2
Baby Geniuses,dgs,27 July 1999,Huh?,Is this movie supposed to be a joke? Or just a mean trick on the unsuspecting audience? But believe me i have seen worse than this moronic combination of Look Who's Talking and Baby's Day Out. Like we needed another one.,2
Baby Geniuses,billy-7,1 October 1999,The pits,Seldom if ever has a star of the magnitude and demonstrable talent of Kathleen Turner appeared in a worse film than this execrable "comedy"--or given a worse performance than Turner's obviously embarrassed and unfunny turn.,1
Baby Geniuses,bellino-angelo2014,4 August 2021,Truly deserving of its status as one of the worst movies ever made,The movie is about a laboratory called Baby Co where some scientists led by Elena Kinder and Heep (Kathleen Turner and Christopher Lloyd) keep super-genius babies in safe laboratory conditions. In the meanwhile the geniuses' twins are raised in a kindergarten facility led by Doctor Dan Bobbins (Peter McNicol) and his wife in order to determine if the teaching methods of Baby Co create smarter babies. One of the babies Sly (most likely a reference to Sylvester Stallone) is much smarter than the doctors and spends most of the movie hiding and attacking those folks in a much dumber version of HOME ALONE and when one night finally manages to escape the laboratory and after a series of events meets the identical twins he organizes with them an attack to the doctors.There are three types of bad movies. One is the super cheap bad movies such as MANOS THE HANDS OF FATE KING DINOSAUR and ROBOT MONSTER. These have incredibly low budgets and can't help but stink but they are a lot of fun to watch because they are so poorly made. The second are movies that are vacuous but with a good budget such as ED CHAIRMAN OF THE BOARD and KAZAAM. These are a bit watchable but generally are a bit insulting towards your intelligence... and you can't certainly blame the budget for being that bad. The third type and BABY GENIUSES is the king of this type is like the second: they are made with a huge budget but they manage to do something bad movies normally don't do; they are so annoying and worthless that you feel like all your braincells vanished!BABY GENIUSES is a horrible movie that made me feel dumber and enraged after watching it. About the only movies that caused me such a visceral reaction were SANTA WITH MUSCLES BEWITCHED and DADDY DAY CAMP. The more and more you watch the movie you really wonder how the mighty such as Christopher Lloyd and Kathleen Turner have fallen for being in such a movie (and this movie killed Lloyd's career forever) while for Peter McNicol and Dom DeLuise... they were right in their element. You wonder that because the premise is so dumb the humour so crass and the movie is full of jokes that are only desperate attempts at humour.However if you think watching babies severely injur adults kick them in the forbidden zone (too many times to count) making adult jokes or many pop culture references this movie is perfect for you just like its sequel (and it makes you wonder how on Earth is allowed to make such movies). Think for a second of JINGLE ALL THE WAY BABY'S DAY OUT HOME ALONE 3 and BABE PIG IN THE CITY all merged in one film and written by incredibly stupid and talentless 10 year olds... this is BABY GENIUSES and it truly deserves its place on IMDB's Bottom 100 (the list of the 100 worst rated and reviewed major movies of all time). Avoid it at all costs like poison and if you have someone who would force you to watch it... RUN!,1
Baby Geniuses,superracingriley,30 November 2019,Awful,I really don't understand why people actually like this movie. I mean it's full of dumb and uninspired bathroom jokes that fall flat on their face! and why does one of babies tell a female to take her clothes off? that is unnecessary and disgusting. Never watch this movie,1
Baby Geniuses,a-twetman,16 August 2012,Babies are not cute enough to validate the existence of this film.,This movie is based around the concept that babies are (supposedly) cute and therefor if the audience is shown enough cute babies the film will be good by association. Sadly for both filmmakers and audience this is not the case; shoving scene after scene of "cute" babies down our throats does not make your movie good. There has to some form of content other than cuteness to create a movie otherwise it might just as well be a series of Youtube clips of toddlers. Admittedly the film makers have attempted to add some kind of plot characters and dialog but it is all so lackluster it might as well not be there. The tired old jokes the more-flat-than-cardboard characters and the nonsense plot do nothing but annoy me further. A night in front of the computer checking baby clips on Youtube is much more rewarding than this.,1
Baby Geniuses,himikey,20 March 1999,"Howard the Duck" of the 90s,This movie is painfully unoriginal and sickeningly unfunny. Your bucket of movie popcorn will draw more laughs while also being less irritating. Only for the very young and/or the easily amused. My vote? 2/10,2
Baby Geniuses,treakle_1978,19 October 2019,One of the worst films of all time.,This by far is one of the worst movies I've ever watched and along with grease 2 Halloween 3 season of the witch and more. Holy crap who thought this was a good idea? To make it worse it got a sequel! I would never subject anyone to this movie unless I wanted to torture them lol. Definitely skip it.,1
Baby Geniuses,tjw1973,19 August 1999,toxic waste from hollywood,This movie is one of the most horrible peaces of sludge to ever make it out of hollywood. It is so bad it is not even funny. In the 50's Ed Wood created some brilliant masterpieces compared to this diaper waste. Parents should avoid letting their children watch this for fear of warping such young minds.,1
Baby Geniuses,drow,11 May 1999,Why?,Who's the greater fool the fool who came up with this or me the fool who actually went to see it. It was a late night showing and my thinking was blurred by a flask of moonshine that's my excuse. But the makers of this film have no excuse for this mess. Why? That's what I want to know? The effects that made these babies do what they did were goodBUT IT'S CREEPY TO SEE BABIES ACTING LIKE THAT!!! so I give it a 1 which is fitting because it is around the average age of the actors and actresses and not far behind the IQ's of those who actually made this film.,2
Baby Geniuses,worldsworstwryter,30 December 2021,Awful in every way imaginable.,Awful in every way imaginable. Strangely inappropriate for kids too despite it being about babies.While watching the bizarre recap montage at the end I started sneezing so I think I might be allergic to this film.,1
Baby Geniuses,ShadowGal,15 August 2004,Not a great movie but passable,First off I have to say that I watched this movie when I was about 14 years old either in '99 or 2000. That probably affected my rating of it as I was in an off-and-on "adults suck" phase. I haven't watched the movie since which explains why I can't go into any detail.Okay. I gave this movie a 5 out of 10. It wasn't a great movie. But in the mind of a young teenager at least it didn't *suck* either. I remember being amused by the attitudes of the babies and I'd always believed that infants and pre-speech toddlers are a lot smarter than any of us adults (or even other kids for that matter!) give them credit for. So the dialogue wasn't great I remember that much. I do remember however laughing at quite a bit of what the main little baby said. I felt bad for this one little baby that got trampled on (figuratively that is) by babies and adults alike. And I felt bad for whomever had to clean up the house those kids were in.I don't remember anything specific about this movie good or bad. That's why I gave it a 5. It's nothing special but I don't remember it as being horrible either. I'll never watch it again though. Basically I guess it'd be worth a watch if nothing good is on and you're curious to see just how bad a movie this was.Thinking about it I maybe should have given it a 4 of 10. Oh well.,4
Baby Geniuses,pgr-fw,23 September 2011,Spectacular! (ly awful!),Stunning! Agonizing! Painful! I didn't think it was possible that there was a worse movie than "Manos: The Hands of Fate". I was wrong. "Manos" has an intelligible story arc. "Manos" has characters I care about a little. "Manos" left me with at least a little admiration for the producer/director/star for having the guts to make it despite having no budget and no talent. Campy and you can at least have fun laughing at it."Baby Geniuses" on the other hand has none of these redeeming qualities. Full of producers directors and stars who know better along with a multi-million dollar budget. Blech! Makes my brain hurt. I don't think it can even be enjoyed with excessive quantities of intoxicants.What's really astounding is that they had the nerve to make a sequel! As much as I enjoy rotten movies I'm not sure I have the guts to watch "Superbabies". A man has to know his limits.,1
Baby Geniuses,Tardis1977,24 April 2003,Bad! Bad! Bad!,Awful! Bad! Awful! Terrible! Mon Dieu! Sacre Bleu! Horrible! Upchuck! Why did Kathleen Turner do this movie. She must have been really desperate to take this one. So must have Christopher Llyod Do Not! see this movie. I repeat if someone has this playing Run! don't walk but Run! to the nearest exit before you shoot your eys out! I can't believe I had to sit through this piece of garbage my little cousins love this piece of sh*t tg their parents unplug the TV whenever this is on and blame the cable company. I don't have anything else to say about this crap but I have to make 10 lines!!!!!!!!!!!!!!!!!!!!!!!!!!!!!!!!!!!!!!!!!!!!!!!!!,1
Baby Geniuses,harybobjoebob,10 October 2020,I can't believe this movie,As a child this was one of my favorite movies I loved it. What was wrong with me? I'm not sure I must have been a stupid kid. The only reason someone would watch this is for the giant scary baby that thing is nightmare fuel. The main dad actor I really like for some reason I feel like I've seen him in other things I actually like but I dont know what they are right now maybe he just looks like someone else I dont know. Dont watch this or show it to your children please,2
Baby Geniuses,blanka-2,31 March 1999,Razzie Awards here we come!,This will definitely be at the Razzies. I just know it. Watching wall paper peel for 20 years is way more entertaining then this.,1
Baby Geniuses,shorteze,24 June 2006,Disgusting.,Rant: If you were to go back in time a hundred years ago and tell people about what film making would become then you would certainly destroy a lot of hopes.I really cannot understand how this got the green lightits really that awful. Everything from acting to special effects is just poorly done.The Plot: A big corporation plans to harness the power of the infant intellect. Ridiculous? Sounds it. Heres the catch: apparently every infant is a genius before a certain age(think its 3 years old). Sounds like it could have potential. One babySylvester or "Sly" breaks out of the labs and tries to tell people about the...or does he want to find his brother? I don't know.You seethe plot is that forgettable. Its just incoherent and the baby dubbing makes you wonder again and again if this was some cruel joke by an evil film company.Not recommended unless your children were bad...real bad...like wreck your 1960s convertible bad.,1
Baby Geniuses,ilcd,12 November 1999,Don't rent this movie,I love being around babies & watching movies that include babies/toddlers. But this movie is at the bottom of my list. I hated the way this movie exploited the toddlers like lab rats. Also it had toddlers cursing at adults which I found offensive. Not only that but it also had toddlers doing violence acts against others which I found not funny at all. Please if you care & love children don't rent this movie. In my opinion the storyline wasn't good & the acting of the characters were poorly done.,1
Baby Geniuses,LVWolfman,22 April 2002,So bad it was the first movie I ever turned off before the end,We last ten minutes into this movie hoping that it'd get better. Some friends with similar tastes (any taste) didn't last that long.Even Kathleen Turner (We love you Kathleen!) couldn't save this stinker.Amazing as it seems someone was brave/stupid enough to make a sequel.,1
Baby Geniuses,vip-danii,15 November 2016,Come On!,Seriously it looks like people either really love or really hate this movie. It has an extremely low rating on IMDb (currently 2.5) which in my opinion it doesn't deserve.Alright so it's a dumb movie. But come on it's a comedy... for kids! It's not supposed to be serious or realistic. It's supposed to provide entertainment. And it does... to some extent at least. It does have a few funny moment you have got to admit.Kathleen Turner is miscast though. She makes a terrible antagonist. Her performance was weak to say the least. Then again the same can be said about most of the cast.I did find the sex joke between two toddlers amusing but yeah it WAS kind of inappropriate as many reviewers have pointed out already. Not a big deal to me personally as long as it's funny and it was.So no it's not "the worst movie ever made". I thought it was watchable and in fact somewhat entertaining.Then there's those who have left raving 10 star reviews saying that this is this movie is "genious"... you guys must be out of your minds.It is nowhere near "good" let alone "genious" but like I said it's a dumb comedy for kids that some adults might find mildly amusing at times. Nothing more nothing less.,5
Baby Geniuses,Bingo84,28 March 1999,Inappropriate language ruins this movie big time!!,Some puzzling questions about this piece of junk....Aside from the horrible acting and awful plot who was the 'genius' who decided to keep in all of the foul language? Do they know that 4 and 5 year olds will be coming to see this movie? Do they actually think that these kids and their parents approve of such words as 'ass' 'hell' and 'damn' all the time?Come on - who do they think their target audience is going to be for this film teenagers and college kids??!!! These words could've been easily cleaned up with softer more appropriate words. But nooooooooo.... they have to ruin it by leaving in all the 'potty mouth' words.Yeah I know the movie's rated PG but the swearing in this film was fairly excessive for pretty young children. I've seen other PG movies with my 5 year old daughter and they were never as bad as this.BEWARE>>>,1
Baby Geniuses,PinkBubbles,4 July 2000,CAUTION: Do not enter "danger zone",I'm lucky I only payed $2 to see this movie. Then again I could have spent my $2 a bit more wisely maybe by slipping one dollar coins into those candy machines in the mini-mall that give out rotton little bubblegum balls. It would have been a better use of my money.This movie even makes Flipper (the modern version) appear to be the next Titanic.Its target audience is the little ones yet it still uses lines like "d**n" and "s**t".A tagline for this movie was "A live-action Rugrats". However Rugrats goes beyond the world of talking babies and their parents' lack of awareness and manages to explore the imaginations of babies and toddlers and have the scene suddenly turn into their fantasized adventures which caught my interest. When did this ever happen in Baby Geniuses?There is not a single moment in this movie where I hadn't wished to walk out of the theater I wasn't ever even scarcely entertained.This movie was also over-advertised where I live since people were wise enough to avoid it.My rating:... I won't even bother.This is the single worst excuse for a movie I have ever seen.,1
Baby Geniuses,bobbyt,19 August 2005,Not a kids movie,I'll start with the positive. Watching the facial expressions and movements of the kids was unreal. How did they get kids so young to cooperate and play out these scenes? How much of it is CG and how much is luck of the shot? Impressive if you have never seen such a thing before.I began to watch this movie with my nephew on DVD. He definitely didn't see the rest of it. The crude dialog coming out of baby's mouths and the endless amount of foul language in the film from the adults-- including scenes in the presence of the children forced to me find something more suitable. It was just crazy. The story line that revolves around children and random jokes for kids clearly isn't aimed at adults. But the dialog is no where near suitable for kids. The other reviews go in depth about the script flaws more...But the disappointments began before the movie even started. The first thing I noticed off the bat after hitting play was the film transfer was extremely bad. Washed out with film scratches and flaws galore. The compression on the DVD was the worst of it. I have honestly never seen such a poorly compiled DVD before. Fade to black moments in the film showed random huge purple pixels shifting at every key frame on a plain black screen. Some scenes looked soft almost to the point of being out of focus audio was a bit over-compressed and very boomy sounding. How can a 13 million dollar film backed by tristar have this poor post production not to mention who would pay 13 million to have this film made? Like all bad movies if you know what you're about to watch and are up for a cheesy flick it just might work. But consider this review a warning to parents and those who find mediocre quality DVDs unwatchable. Not what you'd expect to find on the shelf of a big name video rental store.,1
